{
  "eventId": "018f56a0-2a10-7b5a-8ac0-111111111111",
  "eventType": "organization.created",
  "eventVersion": 1,
  "occurredAt": "2026-10-06T16:00:00Z",
  "recordedAt": "2026-10-06T16:00:00Z",
  "organizationId": "018f56a0-2a10-7b5a-8ac0-222222222222",
  "establishmentId": null,
  "actor": {
    "type": "USER",
    "id": "018f56a0-2a10-7b5a-8ac0-333333333333"
  },
  "aggregate": {
    "type": "Organization",
    "id": "018f56a0-2a10-7b5a-8ac0-222222222222"
  },
  "correlationId": "018f56a0-2a10-7b5a-8ac0-444444444444",
  "causationId": null,
  "requestId": "req_example",
  "dataClassification": "INTERNAL",
  "purpose": "tenant_lifecycle",
  "payload": {
    "businessTypeCode": "SERVICE_PROVIDER"
  }
}
